{
  "$schema": "https://json-schema.org/draft/2020-12/schema",
  "$id": "contracts/control-center/v1/events/entitlement.changed.schema.json",
  "title": "entitlement.changed",
  "description": "Emitted by the Control Center (AWCMS) when an entitlement changes state. OMES only consumes this event (e.g. to decide whether a deployment stays enabled); OMES never owns entitlement state itself (docs/control-center-and-integrations.md section 1).",
  "type": "object",
  "required": [
    "event_id",
    "event_version",
    "event_type",
    "occurred_at",
    "tenant_id",
    "correlation_id",
    "idempotency_key",
    "actor",
    "source",
    "data"
  ],
  "additionalProperties": false,
  "properties": {
    "event_id": {
      "type": "string",
      "pattern": "^[A-Za-z0-9_.:-]{1,128}$"
    },
    "event_version": {
      "type": "string",
      "pattern": "^v[0-9]+$"
    },
    "event_type": {
      "type": "string",
      "const": "entitlement.changed"
    },
    "occurred_at": {
      "type": "string",
      "pattern": "^\\d{4}-\\d{2}-\\d{2}T\\d{2}:\\d{2}:\\d{2}Z$"
    },
    "tenant_id": {
      "type": "string",
      "pattern": "^[A-Za-z0-9_.:-]{1,128}$"
    },
    "correlation_id": {
      "type": "string",
      "pattern": "^[A-Za-z0-9_.:-]{1,128}$"
    },
    "idempotency_key": {
      "type": "string",
      "pattern": "^[A-Za-z0-9_.:-]{8,256}$"
    },
    "actor": {
      "type": "object",
      "required": [
        "type",
        "id"
      ],
      "additionalProperties": false,
      "properties": {
        "type": {
          "type": "string",
          "enum": [
            "user",
            "service"
          ]
        },
        "id": {
          "type": "string",
          "pattern": "^[A-Za-z0-9_.:-]{1,128}$"
        }
      }
    },
    "source": {
      "type": "string",
      "enum": [
        "omes",
        "hermes",
        "control-center"
      ]
    },
    "data": {
      "type": "object",
      "required": [
        "entitlement",
        "previous_state",
        "new_state"
      ],
      "additionalProperties": false,
      "properties": {
        "entitlement": {
          "type": "string"
        },
        "previous_state": {
          "type": "string"
        },
        "new_state": {
          "type": "string"
        }
      }
    }
  }
}
